{
  "$schema": "https://json-schema.org/draft/2020-12/schema",
  "$id": "https://raw.githubusercontent.com/AIAllTheThingz/Public-AI-Governance/main/schemas/v1/completion-result.schema.json",
  "title": "Completion Result",
  "description": "Records implementation state, validation outcomes, limitations, risk, compatibility impact, and review without treating a single successful command as proof of full completion.",
  "type": "object",
  "additionalProperties": false,
  "required": [
    "status",
    "summary",
    "filesChanged",
    "validation",
    "limitations"
  ],
  "properties": {
    "status": {
      "enum": [
        "implemented",
        "validated",
        "partially-validated",
        "not-completed"
      ],
      "description": "Overall completion state."
    },
    "summary": {
      "type": "string",
      "minLength": 1
    },
    "filesChanged": {
      "type": "array",
      "items": {
        "type": "string",
        "minLength": 1
      },
      "uniqueItems": true
    },
    "risk": {
      "enum": [
        "low",
        "moderate",
        "high",
        "critical"
      ]
    },
    "securityImpact": {
      "type": "string",
      "minLength": 1
    },
    "compatibilityImpact": {
      "type": "string",
      "minLength": 1
    },
    "validation": {
      "type": "array",
      "items": {
        "type": "object",
        "additionalProperties": false,
        "required": [
          "name",
          "result"
        ],
        "properties": {
          "name": {
            "type": "string",
            "minLength": 1
          },
          "result": {
            "enum": [
              "passed",
              "failed",
              "not-run"
            ]
          },
          "evidence": {
            "type": "string",
            "minLength": 1
          },
          "environment": {
            "type": "string",
            "minLength": 1
          },
          "limitations": {
            "type": "array",
            "items": {
              "type": "string",
              "minLength": 1
            },
            "uniqueItems": true
          }
        }
      }
    },
    "limitations": {
      "type": "array",
      "items": {
        "type": "string",
        "minLength": 1
      }
    },
    "reviewer": {
      "type": "string",
      "minLength": 1
    },
    "reviewedAt": {
      "type": "string",
      "format": "date-time"
    },
    "artifact": {
      "type": "string",
      "minLength": 1,
      "description": "Commit, tag, digest, or artifact identifier to which the result applies."
    },
    "schemaVersion": {
      "type": "string",
      "const": "1.0.0",
      "description": "Optional explicit instance contract version. Omitted legacy instances are interpreted as version 1.0.0."
    },
    "extensions": {
      "type": "object",
      "description": "Namespaced extension data. Extension keys must be organization- or product-specific and must not redefine standard fields.",
      "propertyNames": {
        "pattern": "^[A-Za-z][A-Za-z0-9_.-]{1,127}$"
      },
      "additionalProperties": true
    }
  },
  "x-schemaVersion": "1.0.0"
}
